Group Name,Pretty Group Name,Contact,Contact email,Group Introduction,Group Results,Group Discussion,Group Acknowledgment,,Wendy Reviewed Graphs
Solano County,,Wendy Schackwitz,,,,"The Solano County sites are among the most intensively monitored locations in this study, with multiple years of ARU deployments complemented by frequent in-person field visits conducted by experienced observers. This combination provides a strong opportunity to evaluate concordance between acoustic interpretations and direct observations across a range of colony sizes, formation types, and outcomes. Across sites and years, acoustic reconstructions of breeding chronology and outcome closely aligned with field observations, including timing of colony establishment, extended or asynchronous nesting activity, and fledgling dispersal. At repeatedly occupied sites such as Rush Ranch, Hay Landfill, Leisure Town Road, and Denverton Creek, acoustic data consistently resolved complex breeding structures, including Sequential and Additions colony types, that were difficult to characterize from episodic field visits alone. Partial and complete abandonment events identified acoustically were temporally consistent with rain and heat events noted during field visits, particularly during early nesting stages. Importantly, acoustic analyses were conducted independently of field notes, allowing later comparison without circular inference. Together, the Solano County sites demonstrate how integrating systematic acoustic monitoring with in-person observations improves confidence in breeding outcome determination and enhances resolution of colony dynamics in a landscape characterized by heterogeneous habitat and variable environmental conditions.
[[ are you sending this to anybody, or is this just for you? If sending, what would they want to know? ]]",,,X
Southern Sierra Research Station,,,,,,"The Southern Sierra Research Station sites illustrate both the strengths and limitations of acoustic monitoring in small Tricolored Blackbird colonies. While ARUs were effective at distinguishing among absence, prospecting, breeding initiation, success, and failure, low colony size resulted in infrequent vocalizations and consequently temporally imprecise breeding-stage assignments. In such cases, breeding activity likely began earlier than first detections, and stage boundaries should be interpreted as approximate rather than exact. These sites highlight an important sampling consideration: for very small colonies, increasing recording frequency, for example recording every 10 minutes rather than every 20 minutes, would likely improve temporal resolution and reduce uncertainty in breeding-stage assignment. Despite these constraints, acoustic monitoring still provided insight into colony outcomes and early failure events that would be difficult to capture through infrequent field visits alone.

[[seems fine, any other info they would be interested in?]]",,,X
Washington,Washington State,"Fidorra, Jason C",Jason.Fidorra@dfw.wa.gov,,,"The Washington State sites represent the northern extent of the monitored range and provide a rare multi-year view of Tricolored Blackbird breeding dynamics in small, isolated wetland systems. Across three years, colonies were established at both McCain Wetlands and Harder Spring, and all deployments documented successful fledging. Despite relatively small colony sizes and reduced detectability of early-stage vocalizations at several deployments, fledgling begging calls provided consistent confirmation of reproductive success. Colony formation types varied among years and sites, including Simple, Sequential, Additions, and Asynchronous structures, demonstrating that a broad range of breeding strategies occurs even at the edge of the species’ range.

Notably, in all three years, breeding activity was detected earlier at McCain Wetlands than at Harder Spring, with the timing of fledging and subsequent colony establishment consistent with birds completing a breeding attempt at McCain before the attempt at Harder Spring. While individual movement between sites cannot be confirmed from acoustic data alone, the repeated temporal sequence across years suggests that the same birds may be using both locations, and there is coordinated use of nearby wetlands rather than independent colony dynamics. This pattern aligns with historical observations that Tricolored Blackbirds may relocate between breeding attempts within a season and highlights the value of continuous acoustic monitoring for identifying such sequential use of habitats.

Together, these sites illustrate how ARU data can resolve fine-scale temporal relationships among nearby colonies, even when colonies are small, habitats are acoustically complex, and traditional field access is limited. Continued monitoring at both locations, ideally combined with banding or telemetry, would help determine whether the same individuals are using multiple sites within a season and clarify how breeding decisions are structured at the northern edge of the species’ distribution.

[[this seems good, unless there's anything else he'd want to know about.]]",,,X
Wind Wolves Preserve,,,,,,"The Wind Wolves Preserve sites supported consistent and largely successful Tricolored Blackbird breeding across multiple years, with colonies forming at most monitored locations and all confirmed breeding attempts producing fledglings. Colony formation types varied among sites and years, including Simple, Asynchronous, and Complex structures, reflecting both single synchronous nesting attempts and prolonged or overlapping breeding activity. Several colonies initiated breeding prior to ARU deployment, indicating early site use, while others exhibited extended breeding periods characterized by sustained overlap of Female Chatter and Begging Calls. Despite variation in colony size and detectability, fledgling vocalizations provided clear confirmation of reproductive success at all occupied sites. No acoustic evidence of abandonment or weather-related failure was detected during the monitoring period. Collectively, these results indicate that Wind Wolves Preserve consistently provides suitable breeding conditions and supports repeated successful reproduction, while also illustrating the diversity of colony structures that can occur within a single protected landscape.

[[probably ""good enough for who it's for""? are they doing more in the future, and if so, should you recommend anything specific to them?]]",,,X